{
  "schema_version": 1,
  "kind": "fidelity_scorecard",
  "scorecard_id": "candidate-zero-pub-synth-446k-attention-output",
  "boundary": "attention_output",
  "status": "draft",
  "recorded_utc": "2026-08-31T22:19:14Z",
  "subject": {
    "impl": "attn_kernel_lab.ops.prefill_extend",
    "loaded_from": "jit",
    "release_id": null,
    "artifact_manifest_sha256": null,
    "source_build_id": "5e1693dc172a24e8cfd48408409c9558cf83c853ee847142b81d6a6fe3ad5cb6",
    "mode": "declared_default_v1",
    "env_switches": {
      "qk_i8": true,
      "rotate": true,
      "center_k": true,
      "return_lse": false,
      "SGLANG_FP8_PREFILL_QK": null,
      "SGLANG_FP8_PREFILL_K_CENTER": null,
      "SGLANG_FP8_PREFILL_BF16_HEADS": null,
      "SGLANG_FP8_PREFILL_ZERO_WS": null,
      "SGLANG_FP8_PREFILL_MIN_TOKENS": null
    }
  },
  "reference": {
    "role": "fp32_reference",
    "impl": "fp32 attention on the fp32 master, explicit bottom-right causal mask",
    "note": "TF32 is off and the cuBLAS workspace is pinned to the contract \u00a73.1 constant; a TF32-contaminated fp32 reference is not one, and the rotation is not reproducible without the pin."
  },
  "controls": [
    {
      "role": "implementation_swap",
      "impl": "bf16 inputs, bf16 P, bf16 output (the donor's bf16_arith scheme)",
      "primary": true,
      "note": "The same reference computed in the target dtype with reordered ops -- FlashAttention's own out_pt. Every metric block's `control` is this quantity at that block's slice."
    },
    {
      "role": "input_rounding",
      "impl": "fp32 attention on bf16-rounded inputs (the donor's bf16 scheme)",
      "primary": false,
      "note": "Input rounding alone, kept because the repository's recorded 0.31-0.45% attention-output control band is in this unit. Per-case values are in the run log, not in a metric block, so there is one and only one anchor for the ratios."
    },
    {
      "role": "harness_floor",
      "assertion": "candidate repeat is bit-identical (same config, same process)",
      "result": "pass",
      "note": "The offline path is deterministic by construction, so any movement here is a harness defect and voids the run rather than widening it."
    },
    {
      "role": "oracle",
      "assertion": "donor P-rounding form (online running-tile-max) vs oracle_a.attention",
      "result": "pass",
      "value": 0.002030888505570627,
      "note": "Floor is oracle_a's own bf16 output cast, not zero. This licenses the P-rounding form the instrument uses; shape {'T': 128, 'q_heads': 6, 'kv_heads': 1, 'N': 512}."
    },
    {
      "role": "oracle",
      "assertion": "candidate vs the donor's simulated pipeline (lab_p: quant.py operands plus the oracle-checked online E4M3 P rounding at 448*r_t), same seeds, same case; max |candidate - simulation| on row_rel_l2 mean, in implementation-swap units",
      "result": "pass",
      "value": 0.7329188532210957,
      "note": "The offline analogue of the live-vs-offline bit-exactness assertion: it separates 'the kernel is lossy' from 'the kernel is computing something else'. Chain: candidate ~ lab_p ~ oracle_a.attention. Not bit-exact by construction -- the kernel accumulates in the tensor cores, casts its output to bf16 and runs 6,974 online-softmax tiles at this depth, while the simulation is fp32 throughout -- so the bar is 2 implementation-swap units, which is FlashAttention's own forward-output multiplier. Raw relative disagreement at its worst is 180.80%; that number is scale-free and misleading where the base is ~5e-5 (v_massive), which is why the anchor unit is what is gated. OBSERVATION, not a defect: this gap is depth-dependent -- 0.01 anchor units at 4,096 tokens, 0.7-0.8 at 446,335 -- i.e. the kernel's implementation adds error the fp32 restatement of its own contract does not predict, and the amount grows with context. Attributing it (output cast vs online rescale over ~7k tiles) is the session owner's call and needs the private lane to say whether it matters."
    },
    {
      "role": "harness_floor",
      "assertion": "the implementation-swap anchor reproduces the instrument's own bf16 yardstick on the same case; max relative difference",
      "result": "pass",
      "value": 0.0,
      "note": "Same code, same seeds, so this must be zero to floating point. It is here because a silently mis-wired anchor would rescale every ratio in the record and nothing else would notice."
    }
  ],
  "fixture_set": {
    "id": "pub-synth-d256-446k-v1",
    "fixture_set_sha256": "d4dec352859c28fcdf736d2a9a3e3e93da4bba5c67ccc245dcc09a271ac387fd",
    "lane": "public_synth",
    "layers": 5,
    "q_heads": 24,
    "kv_heads": 4,
    "head_dim": 256,
    "q_len": 128,
    "depths": [
      446335
    ],
    "slice_semantics": {
      "layer": "fixture_case",
      "row": "query_row",
      "note": "This lane has no model, so its layer axis is the fixture case, not a model layer. The worst-layer mandate is preserved -- the worst case in the population is reported and never averaged away -- but a worst-layer number here is a statement about a distribution, not about layer 31 of anything. The private lane sets layer=model_layer over all sixteen full-attention layers."
    }
  },
  "environment": {
    "device": "NVIDIA GeForce RTX 4090",
    "capability": "sm_89",
    "torch": "2.13.0+cu129",
    "cuda": "12.9",
    "driver": "595.79",
    "gpu_uuid_or_run_id": "local-dev-gpu",
    "allow_tf32_matmul": false,
    "cublas_workspace_config": ":4096:8",
    "observed_temperature_c": 48.0,
    "quant_py_sha256": "02c0d25bd22157764cc0de97a7f7771e72bb8107bdc808f87786248da3a988eb",
    "donor_sha256": "2bae8fe81d2120330a7619798bcf6062d345cf1dc3b4849254837060ab2f7d2c",
    "harness_sha256": "5519b13d35accf5602b70f96ddefe41e01f3ffb90339a1ff9f84baf0f234df8b",
    "python": "3.12.14"
  },
  "metrics": {
    "row_rel_l2": {
      "direction": "lower_is_better",
      "ratio_basis": "direct",
      "mean": 0.035115159455248936,
      "control": 0.005321322873983259,
      "ratio": 6.598952983464354,
      "saturated": false,
      "worst_layer": {
        "layer": 2,
        "layer_name": "rope_like",
        "value": 0.04733854656458484,
        "control": 0.009762405664209073,
        "ratio": 4.849065711143043,
        "saturated": false
      },
      "worst_head": {
        "layer": 3,
        "layer_name": "v_outlier",
        "head": 5,
        "value": 0.05917434674548917,
        "control": 0.005097699739687995,
        "ratio": 11.608048682190715,
        "saturated": false
      },
      "worst_row": {
        "layer": 1,
        "layer_name": "heavy_t3",
        "head": 15,
        "row": 65,
        "value": 0.29931863451519103,
        "control": 0.049124865852451516,
        "ratio": 6.093016832131541,
        "saturated": false
      },
      "per_layer": [
        {
          "layer": 0,
          "layer_name": "gaussian",
          "value": 0.0458016149574673,
          "control": 0.004098435802765404,
          "ratio": 11.17538913908639,
          "saturated": false
        },
        {
          "layer": 1,
          "layer_name": "heavy_t3",
          "value": 0.036085617982734464,
          "control": 0.008329154743325807,
          "ratio": 4.332446580086659,
          "saturated": false
        },
        {
          "layer": 2,
          "layer_name": "rope_like",
          "value": 0.04733854656458484,
          "control": 0.009762405664209073,
          "ratio": 4.849065711143043,
          "saturated": false
        },
        {
          "layer": 3,
          "layer_name": "v_outlier",
          "value": 0.04630171574049461,
          "control": 0.004372127955792454,
          "ratio": 10.59020143249727,
          "saturated": false
        },
        {
          "layer": 4,
          "layer_name": "v_massive",
          "value": 4.830203096347255e-05,
          "control": 4.449020382355779e-05,
          "ratio": 1.0856778978813393,
          "saturated": true
        }
      ]
    },
    "cos_sim": {
      "direction": "higher_is_better",
      "ratio_basis": "one_minus",
      "mean": 0.9992151430174687,
      "control": 0.9999676417433383,
      "ratio": 24.255230766501885,
      "saturated": false,
      "worst_layer": {
        "layer": 2,
        "layer_name": "rope_like",
        "value": 0.9988823472886066,
        "control": 0.9999521846380486,
        "ratio": 23.37434384641784,
        "saturated": false
      },
      "worst_head": {
        "layer": 3,
        "layer_name": "v_outlier",
        "head": 3,
        "value": 0.9981048779791065,
        "control": 0.9999876189893289,
        "ratio": 153.0668271946119,
        "saturated": false
      },
      "worst_row": {
        "layer": 1,
        "layer_name": "heavy_t3",
        "head": 15,
        "row": 65,
        "value": 0.9541904694391499,
        "control": 0.998916155353545,
        "ratio": 42.26577186194035,
        "saturated": false
      },
      "per_layer": [
        {
          "layer": 0,
          "layer_name": "gaussian",
          "value": 0.9989535497981761,
          "control": 0.9999916314029127,
          "ratio": 125.0448780012823,
          "saturated": false
        },
        {
          "layer": 1,
          "layer_name": "heavy_t3",
          "value": 0.9993489595859961,
          "control": 0.9999034747715161,
          "ratio": 6.744769468350809,
          "saturated": false
        },
        {
          "layer": 2,
          "layer_name": "rope_like",
          "value": 0.9988823472886066,
          "control": 0.9999521846380486,
          "ratio": 23.37434384641784,
          "saturated": false
        },
        {
          "layer": 3,
          "layer_name": "v_outlier",
          "value": 0.9988908594351218,
          "control": 0.9999909187676106,
          "ratio": 122.13546766757578,
          "saturated": false
        },
        {
          "layer": 4,
          "layer_name": "v_massive",